{
  "schema": "poodle.g16-nucleus-parity-receipt.v1",
  "component": "Dialog",
  "scenario_id": "nucleus.navigation.dialog",
  "proof_level": "M1",
  "runtime": "gpui-headless",
  "command": "effigy regressions:native",
  "package": "poodle-gpui-preview",
  "package_version": "0.3.0",
  "source_commit": "93266dad973ca6fea2d2e4045bbbf0e21bdf3c0e",
  "lockfile": "packages/gpui/preview/Cargo.lock",
  "lockfile_sha256": "c86c2d11c36c9fcf9326bae438ee6acc3bcedacbaf01ac017a298c1bd3c2a34c",
  "lock_resolution": [
    {
      "name": "gpui",
      "version": "0.2.2",
      "source": "crates.io",
      "checksum": "979b45cfa6ec723b6f42330915a1b3769b930d02b2d505f9697f8ca602bee707"
    },
    {
      "name": "poodle-gpui",
      "version": "0.3.0",
      "source": "workspace"
    },
    {
      "name": "poodle-gpui-preview",
      "version": "0.3.0",
      "source": "workspace"
    },
    {
      "name": "poodle-node",
      "version": "0.3.0",
      "source": "workspace"
    },
    {
      "name": "poodle-render",
      "version": "0.3.0",
      "source": "workspace"
    }
  ],
  "distribution": "workspace",
  "production_path_observation": {
    "observed": true,
    "mount": "HeadlessDriver",
    "render_path": "poodle_render -> poodle_gpui_node_backend::to_gpui",
    "input_dispatch": "gpui-test-platform-dispatch"
  },
  "actions": [
    "mount controlled Dialog modal with title, description, close affordance, body Surface, and action Buttons through GPUI Dialog compat adapter into HeadlessDriver",
    "verify pointer activation inside panel does not trigger backdrop dismissal",
    "pointer activate disabled action and verify inertness",
    "pointer activate Cancel and Confirm action buttons and verify callback traces",
    "pointer activate close button and verify request close emission",
    "test independent dismissal axes: backdrop click (false/true) and Escape key (false/true) through GPUI Dialog compat adapter",
    "verify host refusal leaves Dialog mounted without duplicate emission",
    "verify accepted close triggers host rebuild unmounting Dialog backdrop, surface, and controls"
  ],
  "assertions": [
    "production render path and GPUI Dialog compat adapter resolve root backdrop role, overlay posture, backdrop fill, panel elevated background, border, surface radius, shadow, md width preset, max height, padding, and section spacing",
    "header resolves title typography with heading weight, description typography with text.secondary color, and close affordance with chrome size and pointer cursor",
    "body composes production Surface with panel tone, subtle border, padding scale, and background alpha",
    "actions compose production Buttons with secondary, primary, and disabled states",
    "mounted layout bounds confirm positive dimensions, panel containment within backdrop, and child containment within panel",
    "inside panel clicks are absorbed and never bubble to backdrop dismissal",
    "disabled action button remains inert to pointer activation",
    "Cancel and Confirm action buttons dispatch callbacks through the mounted backend",
    "dismissal axes remain strictly independent in GPUI Dialog compat adapter: close button always requests close, backdrop respects dismiss_on_backdrop, and Escape respects dismiss_on_escape",
    "host refusal preserves mounted Dialog state and subsequent interactions",
    "accepted close rebuilds host tree without Dialog, removing backdrop, surface, and chrome from the mounted backend"
  ],
  "outcome": "passed",
  "artifact_paths": []
}