{
  "schema": "poodle.g16-nucleus-parity-receipt.v1",
  "component": "DetailItem",
  "scenario_id": "nucleus.settings.detail-item",
  "proof_level": "M1",
  "runtime": "gpui-headless",
  "command": "effigy regressions:native",
  "package": "poodle-gpui-preview",
  "package_version": "0.3.0",
  "source_commit": "93266dad973ca6fea2d2e4045bbbf0e21bdf3c0e",
  "lockfile": "packages/gpui/preview/Cargo.lock",
  "lockfile_sha256": "c86c2d11c36c9fcf9326bae438ee6acc3bcedacbaf01ac017a298c1bd3c2a34c",
  "lock_resolution": [
    {
      "name": "gpui",
      "version": "0.2.2",
      "source": "crates.io",
      "checksum": "979b45cfa6ec723b6f42330915a1b3769b930d02b2d505f9697f8ca602bee707"
    },
    {
      "name": "poodle-gpui",
      "version": "0.3.0",
      "source": "workspace"
    },
    {
      "name": "poodle-gpui-preview",
      "version": "0.3.0",
      "source": "workspace"
    },
    {
      "name": "poodle-node",
      "version": "0.3.0",
      "source": "workspace"
    },
    {
      "name": "poodle-render",
      "version": "0.3.0",
      "source": "workspace"
    }
  ],
  "distribution": "workspace",
  "production_path_observation": {
    "observed": true,
    "mount": "HeadlessDriver",
    "render_path": "poodle_render -> poodle_gpui_node_backend::to_gpui",
    "input_dispatch": "gpui-test-platform-dispatch"
  },
  "actions": [
    "mount duplicate caller-scoped controlled DetailItem instances through node_compat::DetailItem::from_spec(...).into_element() in a 640x320 HeadlessDriver host",
    "compose production Text label, supporting, and value nodes with a real Button action through the shared renderer and compatibility adapter",
    "dispatch mounted pointer input to the inert value and interactive left action paths",
    "dispatch mounted keyboard activation to the duplicate right action path",
    "rebuild both host-owned instances across surface inline, surface stacked, and simple inline presentations"
  ],
  "assertions": [
    "portable defaults, explicit presentations, layouts, spans, densities, truncation, empty values, and accessibility labels reach exact mounted metadata",
    "production Text and Button dependencies preserve exact label, supporting, value, and action structure plus typography, color, line-height, weight, and truncation recipes",
    "surface background, radius, padding, alignment, and stacked gaps stay exact while simple inline remains baseline with no surface chrome",
    "both duplicate roots and their children remain contained, ordered, and non-overlapping initially and after every host rebuild",
    "the value and root remain inert while pointer and keyboard action callbacks rebuild only their owning instance",
    "caller-scoped runtime ids, focus, callbacks, controlled state, and geometry remain isolated across duplicate instances"
  ],
  "outcome": "passed",
  "artifact_paths": []
}