{
  "schema": "poodle.g16-nucleus-parity-receipt.v1",
  "component": "StatusIndicator",
  "scenario_id": "nucleus.agent.status-indicator",
  "proof_level": "M1",
  "runtime": "gpui-headless",
  "command": "effigy regressions:native",
  "package": "poodle-gpui-preview",
  "package_version": "0.4.0",
  "source_commit": "59a64af50d0f592e7b12d121f24fa8655d8cd67d",
  "lockfile": "packages/gpui/preview/Cargo.lock",
  "lockfile_sha256": "4cf00ae2dd80c976e57dc9db49cc7cd462e5d841bf51c993e0482fc33e9fa277",
  "lock_resolution": [
    {
      "name": "gpui",
      "version": "0.2.2",
      "source": "crates.io",
      "checksum": "979b45cfa6ec723b6f42330915a1b3769b930d02b2d505f9697f8ca602bee707"
    },
    {
      "name": "poodle-gpui",
      "version": "0.4.0",
      "source": "workspace"
    },
    {
      "name": "poodle-gpui-preview",
      "version": "0.4.0",
      "source": "workspace"
    },
    {
      "name": "poodle-node",
      "version": "0.4.0",
      "source": "workspace"
    },
    {
      "name": "poodle-render",
      "version": "0.4.0",
      "source": "workspace"
    }
  ],
  "distribution": "workspace",
  "production_path_observation": {
    "observed": true,
    "mount": "HeadlessDriver",
    "render_path": "poodle_render -> poodle_gpui_node_backend::to_gpui",
    "input_dispatch": "gpui-test-platform-dispatch"
  },
  "actions": [
    "mount duplicate StatusIndicator instances through node_compat::StatusIndicator::from_spec(...).into_element() in HeadlessDriver",
    "dispatch mounted pointer input through the inert indicator before rebuilding one caller-scoped instance across every status, size, and density posture"
  ],
  "assertions": [
    "production Icon dot and Text label composition preserves exact status, reason, typography, tone, size, density, glow, and wrap metadata",
    "all six statuses, five sizes, and three densities survive host-owned rebuilds while the duplicate instance remains unchanged",
    "duplicate mounted roots have positive extents, preserve authored order, and begin inside the real mount while dot and label stay contained by their production roots on every rebuild",
    "root, Icon dot, and Text label stay outside the focus chain and mounted pointer input cannot mutate the inert host-owned spec",
    "caller-scoped identities keep duplicate metadata, runtime ids, state rebuilds, and geometry isolated",
    "backend mounted observation confirms production render, paint, and GPUI input dispatch after every terminal assertion"
  ],
  "outcome": "passed",
  "artifact_paths": []
}