{
  "schema": "poodle.g16-nucleus-parity-receipt.v1",
  "component": "EditableLabel",
  "scenario_id": "nucleus.navigation.editable-label",
  "proof_level": "M1",
  "runtime": "gpui-headless",
  "command": "effigy regressions:native",
  "package": "poodle-gpui-preview",
  "package_version": "0.3.0",
  "source_commit": "93266dad973ca6fea2d2e4045bbbf0e21bdf3c0e",
  "lockfile": "packages/gpui/preview/Cargo.lock",
  "lockfile_sha256": "c86c2d11c36c9fcf9326bae438ee6acc3bcedacbaf01ac017a298c1bd3c2a34c",
  "lock_resolution": [
    {
      "name": "gpui",
      "version": "0.2.2",
      "source": "crates.io",
      "checksum": "979b45cfa6ec723b6f42330915a1b3769b930d02b2d505f9697f8ca602bee707"
    },
    {
      "name": "poodle-gpui",
      "version": "0.3.0",
      "source": "workspace"
    },
    {
      "name": "poodle-gpui-preview",
      "version": "0.3.0",
      "source": "workspace"
    },
    {
      "name": "poodle-node",
      "version": "0.3.0",
      "source": "workspace"
    },
    {
      "name": "poodle-render",
      "version": "0.3.0",
      "source": "workspace"
    }
  ],
  "distribution": "workspace",
  "production_path_observation": {
    "observed": true,
    "mount": "HeadlessDriver",
    "render_path": "poodle_render -> poodle_gpui_node_backend::to_gpui",
    "input_dispatch": "gpui-test-platform-dispatch"
  },
  "actions": [
    "mount controlled EditableLabel sessions through node_compat::EditableLabel::from_spec(...).into_element() in HeadlessDriver",
    "single-click a default-mode display without entering, double-click it to enter, and enter EnterOrSpace mode separately through pointer, Enter, and Space while programmatic and disabled gestures stay inert",
    "dispatch printable scalar input, Enter, Escape, Tab, and pointer blur through the GPUI test platform",
    "commit every scalar in portable trim set T and preserve ZWSP through mounted input",
    "mount equal-valued caller-id instances and remove one live editor through the production rebuild path"
  ],
  "assertions": [
    "production adapter projects display Button and editing TextInput semantics, one visible mode, accessible-name fallback, label size, weight, relative line-height, explicit sans-family inheritance metadata, empty-state italics, field treatment, and text cursor",
    "mounted bounds are positive, non-overlapping, and contained by the production mount box",
    "live draft paint stays separate from the host-owned committed value until commit and preserves the previous committed snapshot",
    "Enter commits and Escape cancels with display focus restoration while Tab and pointer blur commit exactly once and let focus leave",
    "portable trim removes Unicode White_Space plus BOM, preserves ZWSP, and unchanged trimmed commit still fires once",
    "Unicode scalar maxLength accepts one astral scalar and rejects the next insertion",
    "disabled and programmatic display controls remain inert to their forbidden gestures",
    "equal-valued caller-id instances keep focus, draft, callback, bounds, and teardown identity separate",
    "removing a focused live editor emits neither commit nor cancel"
  ],
  "outcome": "passed",
  "artifact_paths": []
}