{
  "schema": "poodle.g16-nucleus-parity-receipt.v1",
  "component": "AgentQuestion",
  "scenario_id": "nucleus.agent.agent-question",
  "proof_level": "M1",
  "runtime": "gpui-headless",
  "command": "effigy regressions:native",
  "package": "poodle-gpui-preview",
  "package_version": "0.4.0",
  "source_commit": "403d9b81dcac7e0143fd8889dc188e177ce4cfc7",
  "lockfile": "packages/gpui/preview/Cargo.lock",
  "lockfile_sha256": "4cf00ae2dd80c976e57dc9db49cc7cd462e5d841bf51c993e0482fc33e9fa277",
  "lock_resolution": [
    {
      "name": "gpui",
      "version": "0.2.2",
      "source": "crates.io",
      "checksum": "979b45cfa6ec723b6f42330915a1b3769b930d02b2d505f9697f8ca602bee707"
    },
    {
      "name": "poodle-gpui",
      "version": "0.4.0",
      "source": "workspace"
    },
    {
      "name": "poodle-gpui-preview",
      "version": "0.4.0",
      "source": "workspace"
    },
    {
      "name": "poodle-node",
      "version": "0.4.0",
      "source": "workspace"
    },
    {
      "name": "poodle-render",
      "version": "0.4.0",
      "source": "workspace"
    }
  ],
  "distribution": "workspace",
  "production_path_observation": {
    "observed": true,
    "mount": "HeadlessDriver",
    "render_path": "poodle_render -> poodle_gpui_node_backend::to_gpui",
    "input_dispatch": "gpui-test-platform-dispatch"
  },
  "actions": [
    "mount duplicate controlled AgentQuestion instances through node_compat::AgentQuestion::from_spec(...).into_element() in HeadlessDriver",
    "dispatch pointer and keyboard choices plus dismissal through the mounted GPUI test platform while rebuilding from host-owned selections",
    "dispatch mounted pointer input at a production Button option carrying a live callback and host-state sink while its disabled gate is active"
  ],
  "assertions": [
    "production Text and Button composition preserves prompt, option, selection, progress, dismissal, accessibility, and exact token metadata",
    "mounted question roots, option rows, dismissal, and disabled witness have positive full extents, authored non-overlapping order, and real mount or production-parent containment",
    "single-select replacement, multi-select toggling, refusal, dismissal, and host-owned rebuilds preserve exact callback and state traces",
    "duplicate caller identities keep focus, callbacks, state, and bounds isolated",
    "the mounted disabled production Button suppresses its supplied live callback and host mutation; removing the disabled gate makes this oracle fail",
    "backend probe channels and mounted observation confirm production render, accessibility, token, paint, and GPUI input dispatch"
  ],
  "outcome": "passed",
  "artifact_paths": []
}