{
  "schema": "poodle.g16-nucleus-parity-receipt.v1",
  "component": "AgentTranscript",
  "scenario_id": "nucleus.agent.agent-transcript",
  "proof_level": "M1",
  "runtime": "gpui-headless",
  "command": "effigy regressions:native",
  "package": "poodle-gpui-preview",
  "package_version": "0.3.0",
  "source_commit": "93266dad973ca6fea2d2e4045bbbf0e21bdf3c0e",
  "lockfile": "packages/gpui/preview/Cargo.lock",
  "lockfile_sha256": "c86c2d11c36c9fcf9326bae438ee6acc3bcedacbaf01ac017a298c1bd3c2a34c",
  "lock_resolution": [
    {
      "name": "gpui",
      "version": "0.2.2",
      "source": "crates.io",
      "checksum": "979b45cfa6ec723b6f42330915a1b3769b930d02b2d505f9697f8ca602bee707"
    },
    {
      "name": "poodle-gpui",
      "version": "0.3.0",
      "source": "workspace"
    },
    {
      "name": "poodle-gpui-preview",
      "version": "0.3.0",
      "source": "workspace"
    },
    {
      "name": "poodle-node",
      "version": "0.3.0",
      "source": "workspace"
    },
    {
      "name": "poodle-render",
      "version": "0.3.0",
      "source": "workspace"
    }
  ],
  "distribution": "workspace",
  "production_path_observation": {
    "observed": true,
    "mount": "HeadlessDriver",
    "render_path": "poodle_render -> poodle_gpui_node_backend::to_gpui",
    "input_dispatch": "gpui-test-platform-dispatch"
  },
  "actions": [
    "mount caller-scoped AgentTranscript instances through node_compat::AgentTranscript::from_spec(...).into_element() in HeadlessDriver",
    "dispatch disclosure, wheel, and jump-control input through the mounted GPUI test platform while rebuilding and appending host-owned records",
    "replace an empty transcript with a spinning activity through the production factory and observe the mounted dependency structures"
  ],
  "assertions": [
    "paint-time node facts and positive bounds prove the real mounted Text, Surface, EmptyState, and Spinner dependency structures",
    "the mounted user AgentMessage Surface has the exact elevated background and surface radius with no shadow or raw-shell substitution",
    "all five mounted record blocks preserve exact roles, available statuses, content, order, non-overlap, production-parent containment, and caller-scoped identity",
    "host rebuilds append the scoped runtime id in order and preserve disclosure state; the separately mounted scroll fixture preserves detached position while keyboard, pointer, wheel, and jump input take effect",
    "empty and loading rebuilds mount positive contained EmptyState and Spinner plus Text child bounds before terminal receipt emission"
  ],
  "outcome": "passed",
  "artifact_paths": []
}