{
  "schema": "poodle.g16-nucleus-parity-receipt.v1",
  "component": "AgentPlan",
  "scenario_id": "nucleus.agent.agent-plan",
  "proof_level": "M1",
  "runtime": "gpui-headless",
  "command": "effigy regressions:native",
  "package": "poodle-gpui-preview",
  "package_version": "0.3.0",
  "source_commit": "93266dad973ca6fea2d2e4045bbbf0e21bdf3c0e",
  "lockfile": "packages/gpui/preview/Cargo.lock",
  "lockfile_sha256": "c86c2d11c36c9fcf9326bae438ee6acc3bcedacbaf01ac017a298c1bd3c2a34c",
  "lock_resolution": [
    {
      "name": "gpui",
      "version": "0.2.2",
      "source": "crates.io",
      "checksum": "979b45cfa6ec723b6f42330915a1b3769b930d02b2d505f9697f8ca602bee707"
    },
    {
      "name": "poodle-gpui",
      "version": "0.3.0",
      "source": "workspace"
    },
    {
      "name": "poodle-gpui-preview",
      "version": "0.3.0",
      "source": "workspace"
    },
    {
      "name": "poodle-node",
      "version": "0.3.0",
      "source": "workspace"
    },
    {
      "name": "poodle-render",
      "version": "0.3.0",
      "source": "workspace"
    }
  ],
  "distribution": "workspace",
  "production_path_observation": {
    "observed": true,
    "mount": "HeadlessDriver",
    "render_path": "poodle_render -> poodle_gpui_node_backend::to_gpui",
    "input_dispatch": "gpui-test-platform-dispatch"
  },
  "actions": [
    "mount duplicate controlled AgentPlan instances through node_compat::AgentPlan::from_spec(...).into_element() in HeadlessDriver",
    "dispatch refused and accepted pointer or keyboard decisions through the GPUI test platform",
    "rebuild host-owned pending, accepted, dismissed, and revised states through the production adapter path"
  ],
  "assertions": [
    "production AgentMessage, Text, and Button composition preserves plan records, decision order, semantics, and exact contract-owned resting, hover, focus, radius, spacing, and status tokens",
    "mounted roots and decision affordances have positive ordered bounds contained within their caller-scoped plan",
    "refused acceptance remains pending while accepted, dismissed, and revised decisions rebuild before painted affordances disappear",
    "duplicate caller identities keep focus, callbacks, state, and bounds isolated",
    "backend probe channels and mounted observation confirm production render, accessibility, token, paint, and GPUI input dispatch"
  ],
  "outcome": "passed",
  "artifact_paths": []
}