{
  "schema": "poodle.g16-nucleus-parity-receipt.v1",
  "component": "AppHeader",
  "scenario_id": "nucleus.shell.app-header",
  "proof_level": "M1",
  "runtime": "gpui-headless",
  "command": "effigy regressions:native",
  "package": "poodle-gpui-preview",
  "package_version": "0.4.0",
  "source_commit": "403d9b81dcac7e0143fd8889dc188e177ce4cfc7",
  "lockfile": "packages/gpui/preview/Cargo.lock",
  "lockfile_sha256": "4cf00ae2dd80c976e57dc9db49cc7cd462e5d841bf51c993e0482fc33e9fa277",
  "lock_resolution": [
    {
      "name": "gpui",
      "version": "0.2.2",
      "source": "crates.io",
      "checksum": "979b45cfa6ec723b6f42330915a1b3769b930d02b2d505f9697f8ca602bee707"
    },
    {
      "name": "poodle-gpui",
      "version": "0.4.0",
      "source": "workspace"
    },
    {
      "name": "poodle-gpui-preview",
      "version": "0.4.0",
      "source": "workspace"
    },
    {
      "name": "poodle-node",
      "version": "0.4.0",
      "source": "workspace"
    },
    {
      "name": "poodle-render",
      "version": "0.4.0",
      "source": "workspace"
    }
  ],
  "distribution": "workspace",
  "production_path_observation": {
    "observed": true,
    "mount": "HeadlessDriver",
    "render_path": "poodle_render -> poodle_gpui_node_backend::to_gpui",
    "input_dispatch": "gpui-test-platform-dispatch"
  },
  "actions": [
    "render AppHeader with centered custom-identity composite through poodle_render",
    "pointer hover dispatch through HeadlessDriver"
  ],
  "assertions": [
    "production render path resolves shell background, bottom border, size ladder min-height, typography, density padding/gaps, fill-width posture, and aria-label fallback/override",
    "presence of center slot switches layout from flat root regions to symmetric grow trailing column",
    "mounted bounds confirm child containment, positive dimensions, stable region ordering, and non-focusable styled-only root"
  ],
  "outcome": "passed",
  "artifact_paths": []
}