{
  "schema": "poodle.g16-nucleus-parity-receipt.v1",
  "component": "AgentChatInput",
  "scenario_id": "nucleus.agent.agent-chat-input",
  "proof_level": "M1",
  "runtime": "gpui-headless",
  "command": "effigy regressions:native",
  "package": "poodle-gpui-preview",
  "package_version": "0.3.0",
  "source_commit": "93266dad973ca6fea2d2e4045bbbf0e21bdf3c0e",
  "lockfile": "packages/gpui/preview/Cargo.lock",
  "lockfile_sha256": "c86c2d11c36c9fcf9326bae438ee6acc3bcedacbaf01ac017a298c1bd3c2a34c",
  "lock_resolution": [
    {
      "name": "gpui",
      "version": "0.2.2",
      "source": "crates.io",
      "checksum": "979b45cfa6ec723b6f42330915a1b3769b930d02b2d505f9697f8ca602bee707"
    },
    {
      "name": "poodle-gpui",
      "version": "0.3.0",
      "source": "workspace"
    },
    {
      "name": "poodle-gpui-preview",
      "version": "0.3.0",
      "source": "workspace"
    },
    {
      "name": "poodle-node",
      "version": "0.3.0",
      "source": "workspace"
    },
    {
      "name": "poodle-render",
      "version": "0.3.0",
      "source": "workspace"
    }
  ],
  "distribution": "workspace",
  "production_path_observation": {
    "observed": true,
    "mount": "HeadlessDriver",
    "render_path": "poodle_render -> poodle_gpui_node_backend::to_gpui",
    "input_dispatch": "gpui-test-platform-dispatch"
  },
  "actions": [
    "mount caller-scoped controlled AgentChatInput instances through node_compat::AgentChatInput::from_spec(...).into_element() in HeadlessDriver",
    "dispatch pointer and keyboard edits, focus changes, submits, stops, and disabled activations through the GPUI test platform",
    "submit refused and accepted controlled edit proposals, rebuilding the production factory from unchanged or updated host-owned value and selection"
  ],
  "assertions": [
    "production TextInput and Button composition preserves exact AgentChatInput-owned token, data, placeholder, status, and disabled metadata",
    "host refusal rebuilds the mounted production path from unchanged controlled value and selection, while acceptance rebuilds it from updated host-owned state",
    "submit eligibility and exact callback payload order cover empty, allow-empty, read-only, disabled, idle, and busy states",
    "the real mount box and parent bounds contain ordered non-overlapping fields, attachments, editors, toolbars, actions, footers, and sibling instances",
    "caller-scoped instances isolate focus, draft, callbacks, runtime identity, and bounds while disabled pointer input cannot focus or activate the production control"
  ],
  "outcome": "passed",
  "artifact_paths": []
}