{
  "schema": "poodle.g16-nucleus-parity-receipt.v1",
  "component": "SegmentedControl",
  "scenario_id": "nucleus.navigation.segmented-control",
  "proof_level": "M1",
  "runtime": "gpui-headless",
  "command": "effigy regressions:native",
  "package": "poodle-gpui-preview",
  "package_version": "0.3.0",
  "source_commit": "93266dad973ca6fea2d2e4045bbbf0e21bdf3c0e",
  "lockfile": "packages/gpui/preview/Cargo.lock",
  "lockfile_sha256": "c86c2d11c36c9fcf9326bae438ee6acc3bcedacbaf01ac017a298c1bd3c2a34c",
  "lock_resolution": [
    {
      "name": "gpui",
      "version": "0.2.2",
      "source": "crates.io",
      "checksum": "979b45cfa6ec723b6f42330915a1b3769b930d02b2d505f9697f8ca602bee707"
    },
    {
      "name": "poodle-gpui",
      "version": "0.3.0",
      "source": "workspace"
    },
    {
      "name": "poodle-gpui-preview",
      "version": "0.3.0",
      "source": "workspace"
    },
    {
      "name": "poodle-node",
      "version": "0.3.0",
      "source": "workspace"
    },
    {
      "name": "poodle-render",
      "version": "0.3.0",
      "source": "workspace"
    }
  ],
  "distribution": "workspace",
  "production_path_observation": {
    "observed": true,
    "mount": "HeadlessDriver",
    "render_path": "poodle_render -> poodle_gpui_node_backend::to_gpui",
    "input_dispatch": "gpui-test-platform-dispatch"
  },
  "actions": [
    "mount controlled SegmentedControl with one disabled option through HeadlessDriver",
    "pointer activate unselected, selected, and disabled segments through GPUI platform dispatch",
    "keyboard navigate roving focus across enabled segments with arrow keys, Home, End, and wraparound",
    "mount two composed SegmentedControl instances to prove focus and callback isolation"
  ],
  "assertions": [
    "production render path resolves root radiogroup role, direction, size ladder height, track styling, and density padding/gaps",
    "each segment resolves radiobutton role, selected/toggled state, roving tab stop, typography, truncation, and focus patch",
    "pointer and keyboard input update selected value through controlled host rebuild while disabled and same-value clicks remain inert",
    "roving keyboard navigation skips disabled segments, wraps at boundaries, and transfers backend focus handle state",
    "mounted bounds confirm positive dimensions, horizontal segment ordering, and track child containment",
    "two composed instances maintain separate instance runtime IDs, isolated focus handles, and independent change handlers"
  ],
  "outcome": "passed",
  "artifact_paths": []
}